title,author,content,date_published
Limpopo,Kyles Xavier,Once upon a good song but I'll let the past remain still ...,2023-10-21 10:58:40.942787,
Ambituous Village Boy,Success Towu,He was a very serious boy but... ,21-10-2023 11:58:30.478568,
New Date Format,Vincent Odume,A very readable date format for the sake of users readability.,22-10-2023 7:30:15.125489,
The art of war,Vincent Odume,The Chinese natives all know this art and they use it very well.,22-10-2023 1:15:43.587631
A Thousand Sand,Benjamin Onoja,Testing updating a blog feature,23-10-2023 15:45:16.467913,
The mysterious Ray,Onoja Raymond,Ray-Mysteryo is a man who doesn't know how to spell his name,24-10-2023 12:15:43.587631,
The Realtor Scheme,Michael Odume,I am a realtor capable of making billions in a day ...,25-October-2023 16:21:02
Billion Dollar Heist in The 21 Century.,Isaac Ogbonna,Just visit any country with the color green in their flag to gain knowledge on how to execute this heist from the comfort of your home.,27-October-2023 17:00:16
Major Triads,Joseph Okon,This is the combination of notes on the keyboard in the format - 1-4-5,29-October-2023 15:35:57
